{
  "$schema": "supply-chain-inventory.schema.json",
  "schema_version": 1,
  "document_created": "2026-10-18T00:00:00Z",
  "release_status": "production-candidate-project-license-noassertion",
  "release_reason": "The curl 8.23 HTTP/2-only dependency closure and post-link evidence are production-integrated; Fastbed's project license remains NOASSERTION and must be chosen before external distribution.",
  "product": {
    "id": "fastbed",
    "name": "fastbed",
    "version": "0.1.0",
    "bom_ref": "pkg:generic/fastbed@0.1.0",
    "purl": "pkg:generic/fastbed@0.1.0",
    "source_url": "urn:fastbed:source-tree",
    "license": "NOASSERTION",
    "source_paths": [
      "CMakeLists.txt",
      "assets",
      "cmake",
      "include",
      "src",
      "tools/build-static-deps.sh",
      "tools/embed-resources.py",
      "third_party/crawler-user-agents",
      "third_party/yyjson"
    ],
    "version_evidence": {
      "path": "CMakeLists.txt",
      "literal": "project(fastbed VERSION 0.1.0 LANGUAGES C)"
    }
  },
  "components": [
    {
      "id": "yyjson",
      "name": "yyjson",
      "version": "0.13.0",
      "type": "library",
      "bom_ref": "pkg:github/ibireme/yyjson@0.13.0",
      "purl": "pkg:github/ibireme/yyjson@0.13.0",
      "source_url": "https://github.com/ibireme/yyjson/tree/6447536015f3d600f3d65323b10976103b337ca7",
      "download_url": "https://github.com/ibireme/yyjson/archive/6447536015f3d600f3d65323b10976103b337ca7.tar.gz",
      "source_sha256": "13d53411c9d818836a2dc0b3f4be40c34ee4e0fcd21ff903e0aebbfd52e9e08d",
      "license": "MIT",
      "security_disposition": "no-named-finding-in-this-vex",
      "description": "Vendored JSON parser at tag 0.13.0 and commit 6447536015f3d600f3d65323b10976103b337ca7.",
      "local_files": [
        { "path": "third_party/yyjson/yyjson.c", "sha256": "d2d58ef0a3b2267862dc363832c4f3185fd375aea933d5d3419d1a940d6ece2e" },
        { "path": "third_party/yyjson/yyjson.h", "sha256": "ef803cda5c06b8962face6dfa39c3284b3bcf3e73f4d7317664690cc779679ca" },
        { "path": "third_party/yyjson/LICENSE", "sha256": "45e384d3d52c73cba3a64d6e6c25d47cd738cd8a55c30629e3201046eda62947" }
      ],
      "declaration_evidence": {
        "path": "third_party/yyjson/yyjson.h",
        "literals": ["#define YYJSON_VERSION_STRING \"0.13.0\""]
      },
      "runtime_license": {
        "path": "/usr/share/licenses/fastbed/yyjson-LICENSE",
        "sha256": "45e384d3d52c73cba3a64d6e6c25d47cd738cd8a55c30629e3201046eda62947"
      }
    },
    {
      "id": "crawler-user-agents",
      "name": "crawler-user-agents",
      "version": "1.59.0",
      "type": "data",
      "bom_ref": "pkg:pypi/crawler-user-agents@1.59.0",
      "purl": "pkg:pypi/crawler-user-agents@1.59.0",
      "source_url": "https://pypi.org/project/crawler-user-agents/1.59.0/",
      "download_url": "https://files.pythonhosted.org/packages/89/de/83854dfe46685dc765ef2334bcc3ba0b65b25346604f3f09f503c4201c80/crawler_user_agents-1.59.0-py3-none-any.whl",
      "source_sha256": "59f9ad25cf1774111a59b77a8e993424495374d709cbcf065064b225d975524c",
      "license": "MIT",
      "security_disposition": "no-named-finding-in-this-vex",
      "description": "Vendored crawler routing data, byte-identical to the file in the 1.59.0 wheel.",
      "local_files": [
        { "path": "third_party/crawler-user-agents/crawler-user-agents.json", "sha256": "4e414e18ed3f64b9b8298a9f042c83e1ccf54414d8a742fb1f0ec9441d5170e4" },
        { "path": "third_party/crawler-user-agents/LICENSE", "sha256": "bd1d54278c29a12c1c3009259965a620c59363b8d7f5740d98d3fc38f319d7a5" }
      ],
      "declaration_evidence": {
        "path": "third_party/README.md",
        "literals": ["crawler-user-agents | Python package `1.59.0`"]
      },
      "runtime_license": {
        "path": "/usr/share/licenses/fastbed/crawler-user-agents-LICENSE",
        "sha256": "bd1d54278c29a12c1c3009259965a620c59363b8d7f5740d98d3fc38f319d7a5"
      }
    },
    {
      "id": "libmicrohttpd",
      "name": "GNU libmicrohttpd",
      "version": "1.0.10",
      "type": "library",
      "bom_ref": "pkg:generic/gnu-libmicrohttpd@1.0.10",
      "purl": "pkg:generic/gnu-libmicrohttpd@1.0.10",
      "source_url": "https://www.gnu.org/software/libmicrohttpd/",
      "download_url": "https://ftp.gnu.org/gnu/libmicrohttpd/libmicrohttpd-1.0.10.tar.gz",
      "source_sha256": "04bfe8ef75db7d629a33de767599765cecadc56274a39822d5d081030d577685",
      "license": "LGPL-2.1-or-later OR eCos-2.0",
      "security_disposition": "no-named-finding-in-this-vex",
      "description": "Built from the pinned upstream source archive and statically embedded in Fastbed; LGPL relink material is emitted per architecture.",
      "local_files": [],
      "declaration_evidence": {
        "path": "tools/build-static-deps.sh",
        "literals": [
          "https://ftp.gnu.org/gnu/libmicrohttpd/libmicrohttpd-1.0.10.tar.gz",
          "04bfe8ef75db7d629a33de767599765cecadc56274a39822d5d081030d577685",
          "--enable-static",
          "--disable-shared",
          "--enable-https=no"
        ]
      },
      "runtime_license": {
        "path": "/usr/share/licenses/libmicrohttpd/COPYING",
        "sha256": "7399547209438c93f9b90297954698773d4846cea44cde5ca982c84c45952a3b"
      },
      "runtime_evidence": [
        { "path": "/usr/local/share/fastbed-static-deps/SOURCE-OFFER.txt", "sha256": "75c9e6dcfde6ed077ae88a41f44bb298486b09a741c8bc58b6e0e46085c60bb3" },
        { "path": "/usr/local/share/fastbed-source-offers/libmicrohttpd-1.0.10.tar.gz", "sha256": "04bfe8ef75db7d629a33de767599765cecadc56274a39822d5d081030d577685" }
      ]
    },
    {
      "id": "libyaml",
      "name": "LibYAML",
      "version": "0.2.5",
      "type": "library",
      "bom_ref": "pkg:github/yaml/libyaml@0.2.5",
      "purl": "pkg:github/yaml/libyaml@0.2.5",
      "source_url": "https://github.com/yaml/libyaml",
      "download_url": "https://github.com/yaml/libyaml/releases/download/0.2.5/yaml-0.2.5.tar.gz",
      "source_sha256": "c642ae9b75fee120b2d96c712538bd2cf283228d2337df2cf2988e3c02678ef4",
      "license": "MIT",
      "security_disposition": "no-named-finding-in-this-vex",
      "description": "Built from the pinned upstream source archive and statically embedded in Fastbed.",
      "local_files": [],
      "declaration_evidence": {
        "path": "tools/build-static-deps.sh",
        "literals": [
          "https://github.com/yaml/libyaml/releases/download/0.2.5/yaml-0.2.5.tar.gz",
          "c642ae9b75fee120b2d96c712538bd2cf283228d2337df2cf2988e3c02678ef4",
          "--enable-static",
          "--disable-shared"
        ]
      },
      "runtime_license": {
        "path": "/usr/share/licenses/libyaml/License",
        "sha256": "c40112449f254b9753045925248313e9270efa36d226b22d82d4cc6c43c57f29"
      },
      "runtime_evidence": [
        { "path": "/usr/local/share/fastbed-source-offers/yaml-0.2.5.tar.gz", "sha256": "c642ae9b75fee120b2d96c712538bd2cf283228d2337df2cf2988e3c02678ef4" }
      ]
    }
  ],
  "static_deps_bundle": {
    "metadata_relative_path": "share/fastbed-static-deps",
    "manifest_expectations": {
      "profile": "fastbed-static-deps-v1",
      "source_date_epoch": "1774606016",
      "libmicrohttpd_version": "1.0.10",
      "libmicrohttpd_source_sha256": "04bfe8ef75db7d629a33de767599765cecadc56274a39822d5d081030d577685",
      "libyaml_version": "0.2.5",
      "libyaml_source_sha256": "c642ae9b75fee120b2d96c712538bd2cf283228d2337df2cf2988e3c02678ef4",
      "builder_sha256": "b7cd7ddc7abff4b6d2b1b4d2fde7040e2236a98d09347bb3886d1706a19b4d26"
    },
    "libraries": ["lib/libmicrohttpd.a", "lib/libyaml.a"],
    "source_archives": [
      "source/static-deps/libmicrohttpd-1.0.10.tar.gz",
      "source/static-deps/yaml-0.2.5.tar.gz"
    ]
  },
  "curl_bundle": {
    "metadata_relative_path": "share/fastbed-curl-impersonate",
    "manifest_expectations": {
      "profile": "http2-only",
      "source_date_epoch": "1774606016",
      "curl_version": "8.23.0-IMPERSONATE",
      "protocols": "http,https",
      "http3": "false",
      "resolver_backend": "threaded",
      "curl_source_sha256": "8dadd7d2536a314f982ad05a651b713f426bf7d02cc2c76cffb9796f2218e6c5",
      "curl_source_signature_sha256": "dba1562fec2bf698a1226054e6757940e4bf2ab87b3b222a5e7b91348f0b82e2",
      "curl_impersonate_source_commit": "9607b22ccf6c440e560c5f8ad5292b8044bb6dd7",
      "curl_impersonate_source_sha256": "19bcc1aa84a9a69b2ff471af580cae5970baf15e13f77271b0b66c86baeaa131",
      "curl_production_patch_sha256": "5b7034eb94c458eac87a775b6306401b875d7baae13f1aecc443554c8e65c083",
      "curl_http2_source_sha256": "5f492fb8c930277864630c3f6661a437fe1d77338b782ceacb6c90ea25d84b44",
      "curl_easy_source_sha256": "34a5c20e944ad4fc2c369984d1cd149a2c998cb775a77d668faf17ceb005bcc0",
      "curl_impersonate_source_file_sha256": "237e7dd71737ef7fd59579ff33d5c448c2f6151ad7788b7ae586afe91c9d22fa",
      "boringssl_revision": "673e61fc215b178a90c0e67858bbf162c8158993",
      "boringssl_source_sha256": "edb7d61e8de3f791070172723ee41fbc550fb55080cdb187bb4a05e60e059a22",
      "boringssl_base_patch_sha256": "f6315235ea19778fbca8b6544732024f854f38eaa5a600d621f1ac55b4e22424",
      "boringssl_security_patch_sha256": "2c9277a0576c6ed943386490c1ed53ba2e5b8ccef2f1ec4c0c326e4e2177c2dd",
      "boringssl_security_prerequisite_commit": "5386d908a663a424d154cbae7f76f2266c60c2fe",
      "boringssl_security_fix_commit": "9b639f5b3b086508c03f6a4a1792e4a6043777ac",
      "boringssl_patched_x509_vfy_sha256": "b81cc94a5f2bec83cef2c5fd566aa7e05712c87d2fe20e6d8eeca79dd1cd9233",
      "nghttp2_version": "1.68.1",
      "nghttp2_source_sha256": "b761b53cb64916657ea84437973d508fd675e96bb2feb9593a1e43d1959abe95",
      "nghttp2_source_signature_sha256": "95f96ddec895cbde8afce6b10ac036240cb79bde1fc0f693308e95bcbb6e6f7c",
      "nghttp2_priority_compat_patch_sha256": "bf30fc417c26afcaafe732629073db13fc1563edcd7964ee7c1fbf300f7eb3f3",